id,app_id,app_name,category,rating,review_text,helpful_votes,total_votes,app_size_mb,price,version,date,user_id,helpful_ratio,is_free,review_length,review_word_count,cleaned_review,sentiment_label,sentiment_score,rating_category,size_category
2185,25,App_25,News,1,"Hate this app, full of bug and hate issues.",1,26,351.7,0,1.0,2025-06-30,1056,0.038461538461538464,1,43,9,hate this app full of bug and hate issues,Negative,3,Low,Large
2186,27,App_27,Health & Fitness,5,Outstanding app with great features!,8,26,381.0,0,2.1,2025-04-21,1126,0.3076923076923077,1,36,5,outstanding app with great features,Positive,2,High,Large
2187,11,App_11,Entertainment,4,This app is outstanding! Really amazing experience.,11,28,397.4,0,1.1,2025-04-20,3426,0.39285714285714285,1,51,7,this app is outstanding really amazing experience,Positive,2,High,Large
2188,36,App_36,Productivity,2,Horrible app with terrible problems!,8,16,166.7,0,1.1,2024-12-31,5868,0.5,1,36,5,horrible app with terrible problems,Negative,2,Low,Large
2189,18,App_18,Social,1,"Hate this app, full of terrible and slow issues.",14,20,402.3,0,1.0,2024-07-07,2891,0.7,1,48,9,hate this app full of terrible and slow issues,Negative,3,Low,Large
2190,23,App_23,Games,5,"Love this app, very awesome and love!",14,30,77.1,0.99,2.1,2024-09-02,3150,0.4666666666666667,0,37,7,love this app very awesome and love,Positive,3,High,Medium
2191,1,App_1,Health & Fitness,5,Perfect app with amazing features!,11,16,280.5,0,2.0,2024-10-07,4936,0.6875,1,34,5,perfect app with amazing features,Positive,2,High,Large
2192,35,App_35,Games,1,"Hate this app, full of awful and terrible issues.",3,20,147.4,1.99,1.2,2025-02-28,5936,0.15,0,49,9,hate this app full of awful and terrible issues,Negative,3,Low,Medium
2193,22,App_22,Productivity,1,Slow app with awful problems!,8,10,237.4,0,2.0,2025-02-05,3111,0.8,1,29,5,slow app with awful problems,Negative,2,Low,Large
2194,12,App_12,Social,4,Outstanding app with brilliant features!,7,1,195.8,0.99,2.0,2024-09-19,1408,7.0,0,40,5,outstanding app with brilliant features,Positive,2,High,Large
2195,15,App_15,Finance,4,Outstanding app with amazing features!,4,4,114.8,0.99,2.0,2025-02-24,4924,1.0,0,38,5,outstanding app with amazing features,Positive,2,High,Medium
2196,26,App_26,Travel,5,"Love this app, very brilliant and great!",10,18,165.0,0,2.0,2024-12-24,6014,0.5555555555555556,1,40,7,love this app very brilliant and great,Positive,3,High,Large
2197,2,App_2,News,4,Perfect app with excellent features!,0,27,212.5,4.99,2.1,2024-08-10,1800,0.0,0,36,5,perfect app with excellent features,Positive,2,High,Large
2198,23,App_23,Productivity,4,"Love this app, very outstanding and brilliant!",0,13,38.0,0,1.2,2024-11-29,8531,0.0,1,46,7,love this app very outstanding and brilliant,Positive,3,High,Small
2199,29,App_29,Business,3,"The app is normal, nothing special. Just fine.",2,13,162.6,0,1.0,2025-03-10,7852,0.15384615384615385,1,46,8,the app is normal nothing special just fine,Neutral,0,Medium,Large
2200,5,App_5,Business,4,This app is brilliant! Really outstanding experience.,4,12,113.9,0,1.2,2025-03-25,8846,0.3333333333333333,1,53,7,this app is brilliant really outstanding experience,Positive,2,High,Medium
2201,40,App_40,Travel,4,"Love this app, very excellent and fantastic!",8,10,232.6,1.99,1.1,2025-01-18,1149,0.8,0,44,7,love this app very excellent and fantastic,Positive,3,High,Large
2202,44,App_44,Productivity,4,"Love this app, very love and excellent!",5,7,154.2,0,1.0,2025-02-12,2310,0.7142857142857143,1,39,7,love this app very love and excellent,Positive,3,High,Large
2203,9,App_9,Business,4,"Love this app, very amazing and awesome!",7,28,202.2,0,2.1,2025-01-10,6166,0.25,1,40,7,love this app very amazing and awesome,Positive,3,High,Large
2204,38,App_38,Games,4,"Love this app, very fantastic and excellent!",18,26,192.5,0,1.1,2024-12-26,8408,0.6923076923076923,1,44,7,love this app very fantastic and excellent,Positive,3,High,Large
2205,49,App_49,Entertainment,1,Worst app with hate problems!,10,22,301.9,0,1.1,2025-05-21,6278,0.45454545454545453,1,29,5,worst app with hate problems,Negative,2,Low,Large
2206,9,App_9,News,4,This app is fantastic! Really love experience.,8,1,456.3,0,2.0,2024-12-14,4011,8.0,1,46,7,this app is fantastic really love experience,Positive,2,High,Large
2207,45,App_45,Travel,5,"Love this app, very brilliant and amazing!",5,4,245.3,4.99,2.1,2025-04-22,3146,1.25,0,42,7,love this app very brilliant and amazing,Positive,3,High,Large
2208,6,App_6,Health & Fitness,1,This app is crash. Very slow experience.,3,12,343.8,0,2.0,2024-12-19,4439,0.25,1,40,7,this app is crash very slow experience,Negative,2,Low,Large
2209,1,App_1,Health & Fitness,4,"Love this app, very love and excellent!",1,7,64.9,0,1.1,2024-10-19,1739,0.14285714285714285,1,39,7,love this app very love and excellent,Positive,3,High,Medium
2210,50,App_50,Education,3,"The app is okay, nothing special. Just average.",1,14,52.1,0,1.0,2024-09-10,4921,0.07142857142857142,1,47,8,the app is okay nothing special just average,Neutral,0,Medium,Medium
2211,14,App_14,Education,4,"Love this app, very brilliant and love!",19,16,47.0,0,1.0,2024-08-06,1355,1.1875,1,39,7,love this app very brilliant and love,Positive,3,High,Small
2212,38,App_38,Education,2,"Hate this app, full of bug and awful issues.",4,6,421.6,0,1.2,2024-07-09,9064,0.6666666666666666,1,44,9,hate this app full of bug and awful issues,Negative,3,Low,Large
2213,48,App_48,Education,1,This app is useless. Very horrible experience.,14,19,498.8,1.99,1.1,2025-03-08,1007,0.7368421052631579,0,46,7,this app is useless very horrible experience,Negative,2,Low,Large
2214,50,App_50,Education,3,"The app is standard, nothing special. Just average.",7,3,481.4,0.99,2.0,2024-11-06,9756,2.3333333333333335,0,51,8,the app is standard nothing special just average,Neutral,0,Medium,Large
2215,19,App_19,Education,5,"Love this app, very fantastic and perfect!",9,27,126.3,0,1.0,2024-08-22,5844,0.3333333333333333,1,42,7,love this app very fantastic and perfect,Positive,3,High,Medium
2216,23,App_23,Entertainment,5,This app is brilliant! Really amazing experience.,14,16,216.8,0,2.0,2025-01-09,1957,0.875,1,49,7,this app is brilliant really amazing experience,Positive,2,High,Large
2217,43,App_43,Finance,3,"The app is standard, nothing special. Just fine.",4,1,393.0,0,1.0,2024-07-09,6261,4.0,1,48,8,the app is standard nothing special just fine,Neutral,0,Medium,Large
2218,4,App_4,Health & Fitness,4,This app is amazing! Really great experience.,4,8,39.3,0,2.0,2024-08-16,9963,0.5,1,45,7,this app is amazing really great experience,Positive,2,High,Small
2219,29,App_29,Games,4,Fantastic app with wonderful features!,13,7,171.0,0,1.1,2024-07-17,8967,1.8571428571428572,1,38,5,fantastic app with wonderful features,Positive,2,High,Large
2220,23,App_23,Travel,2,This app is hate. Very awful experience.,12,27,319.7,0.99,2.1,2024-12-26,7784,0.4444444444444444,0,40,7,this app is hate very awful experience,Negative,2,Low,Large
2221,32,App_32,Social,3,"The app is okay, nothing special. Just normal.",19,10,100.3,0,1.1,2024-11-12,6515,1.9,1,46,8,the app is okay nothing special just normal,Neutral,0,Medium,Medium
2222,16,App_16,Travel,5,This app is outstanding! Really excellent experience.,2,7,75.9,0,2.1,2024-07-30,9228,0.2857142857142857,1,53,7,this app is outstanding really excellent experience,Positive,2,High,Medium
2223,25,App_25,Travel,5,"Love this app, very love and excellent!",17,23,132.6,0,2.1,2025-03-21,9141,0.7391304347826086,1,39,7,love this app very love and excellent,Positive,3,High,Medium
2224,37,App_37,Social,4,Awesome app with love features!,4,2,51.7,0.99,1.0,2024-12-16,6785,2.0,0,31,5,awesome app with love features,Positive,2,High,Medium
2225,28,App_28,Health & Fitness,2,"Hate this app, full of horrible and hate issues.",14,28,397.5,0,1.2,2025-05-31,3367,0.5,1,48,9,hate this app full of horrible and hate issues,Negative,3,Low,Large
2226,18,App_18,Education,4,This app is awesome! Really love experience.,15,27,185.9,0,2.0,2024-08-22,8688,0.5555555555555556,1,44,7,this app is awesome really love experience,Positive,2,High,Large
2227,17,App_17,News,5,"Love this app, very wonderful and outstanding!",18,14,84.1,0,2.1,2025-02-05,7022,1.2857142857142858,1,46,7,love this app very wonderful and outstanding,Positive,3,High,Medium
2228,2,App_2,Business,5,"Love this app, very fantastic and excellent!",0,14,291.4,4.99,2.0,2025-01-16,7276,0.0,0,44,7,love this app very fantastic and excellent,Positive,3,High,Large
2229,22,App_22,Social,4,"Love this app, very excellent and great!",4,25,226.4,0,2.0,2025-04-02,4791,0.16,1,40,7,love this app very excellent and great,Positive,3,High,Large
2230,45,App_45,Games,4,Brilliant app with wonderful features!,6,9,344.0,0,1.1,2025-05-26,3146,0.6666666666666666,1,38,5,brilliant app with wonderful features,Positive,2,High,Large
2231,20,App_20,Health & Fitness,4,This app is awesome! Really great experience.,4,26,102.0,1.99,2.0,2024-09-24,1102,0.15384615384615385,0,45,7,this app is awesome really great experience,Positive,2,High,Medium
2232,23,App_23,Finance,3,"Pretty standard app, decent overall.",4,12,62.5,0,1.0,2024-11-10,1396,0.3333333333333333,1,36,5,pretty standard app decent overall,Neutral,0,Medium,Medium
2233,42,App_42,Travel,3,"The app is decent, nothing special. Just average.",9,15,280.0,1.99,1.1,2025-02-28,4163,0.6,0,49,8,the app is decent nothing special just average,Neutral,0,Medium,Large
2234,47,App_47,Productivity,4,"Love this app, very great and perfect!",2,23,461.7,0,2.0,2025-06-26,7478,0.08695652173913043,1,38,7,love this app very great and perfect,Positive,3,High,Large
2235,41,App_41,Entertainment,2,"Hate this app, full of hate and slow issues.",6,1,60.8,4.99,1.1,2025-06-19,1802,6.0,0,44,9,hate this app full of hate and slow issues,Negative,3,Low,Medium
2236,47,App_47,News,5,"Love this app, very perfect and outstanding!",4,13,409.5,0.99,2.1,2025-03-20,4352,0.3076923076923077,0,44,7,love this app very perfect and outstanding,Positive,3,High,Large
2237,14,App_14,Health & Fitness,5,This app is wonderful! Really fantastic experience.,16,6,469.6,0.99,2.1,2024-12-07,9171,2.6666666666666665,0,51,7,this app is wonderful really fantastic experience,Positive,2,High,Large
2238,41,App_41,Social,4,This app is love! Really fantastic experience.,10,21,340.2,0.99,1.2,2024-11-22,3180,0.47619047619047616,0,46,7,this app is love really fantastic experience,Positive,2,High,Large
2239,24,App_24,Health & Fitness,1,This app is horrible. Very terrible experience.,6,5,134.5,0,1.0,2024-09-17,4525,1.2,1,47,7,this app is horrible very terrible experience,Negative,2,Low,Medium
2240,42,App_42,Games,3,"Pretty okay app, standard overall.",9,13,59.3,0,2.1,2024-07-14,1983,0.6923076923076923,1,34,5,pretty okay app standard overall,Neutral,0,Medium,Medium
2241,4,App_4,Entertainment,4,Outstanding app with brilliant features!,20,25,365.5,0,1.2,2024-08-10,2116,0.8,1,40,5,outstanding app with brilliant features,Positive,2,High,Large
2242,4,App_4,Business,1,"Hate this app, full of worst and awful issues.",12,13,447.3,0,1.1,2025-01-14,4128,0.9230769230769231,1,46,9,hate this app full of worst and awful issues,Negative,3,Low,Large
2243,42,App_42,Social,4,Perfect app with outstanding features!,6,16,158.6,0,2.1,2025-06-07,4229,0.375,1,38,5,perfect app with outstanding features,Positive,2,High,Large
2244,41,App_41,Games,1,Awful app with bug problems!,10,13,144.5,0,2.0,2024-09-24,5296,0.7692307692307693,1,28,5,awful app with bug problems,Negative,2,Low,Medium
2245,39,App_39,Games,1,Hate app with crash problems!,3,13,449.2,0,2.1,2024-08-06,4345,0.23076923076923078,1,29,5,hate app with crash problems,Negative,2,Low,Large
2246,7,App_7,Health & Fitness,4,"Love this app, very amazing and brilliant!",16,30,197.7,4.99,2.1,2024-11-28,2848,0.5333333333333333,0,42,7,love this app very amazing and brilliant,Positive,3,High,Large
2247,37,App_37,Finance,2,"Hate this app, full of bug and crash issues.",18,24,357.8,0,1.1,2025-04-12,7780,0.75,1,44,9,hate this app full of bug and crash issues,Negative,3,Low,Large
2248,3,App_3,Education,1,Terrible app with useless problems!,6,12,98.8,0,2.1,2025-05-29,6697,0.5,1,35,5,terrible app with useless problems,Negative,2,Low,Medium
2249,29,App_29,Productivity,4,This app is outstanding! Really awesome experience.,11,8,493.8,0,2.1,2024-10-15,3672,1.375,1,51,7,this app is outstanding really awesome experience,Positive,2,High,Large
2250,25,App_25,Health & Fitness,3,"The app is standard, nothing special. Just average.",14,29,389.5,0,2.1,2025-06-10,2090,0.4827586206896552,1,51,8,the app is standard nothing special just average,Neutral,0,Medium,Large
2251,35,App_35,Business,4,Fantastic app with brilliant features!,15,20,435.2,0,1.1,2025-06-29,3484,0.75,1,38,5,fantastic app with brilliant features,Positive,2,High,Large
2252,22,App_22,Entertainment,5,This app is excellent! Really wonderful experience.,15,25,195.2,0,1.1,2025-02-22,6188,0.6,1,51,7,this app is excellent really wonderful experience,Positive,2,High,Large
2253,24,App_24,Games,1,This app is hate. Very useless experience.,16,12,472.0,0,1.1,2025-06-30,9918,1.3333333333333333,1,42,7,this app is hate very useless experience,Negative,2,Low,Large
2254,13,App_13,Games,4,This app is outstanding! Really wonderful experience.,0,21,231.1,1.99,2.1,2025-04-08,8926,0.0,0,53,7,this app is outstanding really wonderful experience,Positive,2,High,Large
2255,31,App_31,Finance,5,Amazing app with brilliant features!,9,5,162.9,0.99,2.0,2024-08-02,9256,1.8,0,36,5,amazing app with brilliant features,Positive,2,High,Large
2256,13,App_13,Games,5,This app is brilliant! Really great experience.,14,30,46.1,0,1.1,2025-02-10,3307,0.4666666666666667,1,47,7,this app is brilliant really great experience,Positive,2,High,Small
2257,44,App_44,Business,2,Crash app with worst problems!,1,12,370.7,0,2.0,2024-11-04,2539,0.08333333333333333,1,30,5,crash app with worst problems,Negative,2,Low,Large
2258,46,App_46,Health & Fitness,5,This app is amazing! Really wonderful experience.,12,12,356.3,0,2.0,2024-12-08,8458,1.0,1,49,7,this app is amazing really wonderful experience,Positive,2,High,Large
2259,3,App_3,Travel,4,Brilliant app with fantastic features!,7,7,147.3,0,1.0,2024-08-22,7007,1.0,1,38,5,brilliant app with fantastic features,Positive,2,High,Medium
2260,19,App_19,Productivity,2,This app is bug. Very useless experience.,14,20,104.1,0.99,1.1,2025-05-18,2244,0.7,0,41,7,this app is bug very useless experience,Negative,2,Low,Medium
2261,16,App_16,Travel,5,This app is great! Really wonderful experience.,11,23,145.8,0.99,2.0,2025-06-07,2868,0.4782608695652174,0,47,7,this app is great really wonderful experience,Positive,2,High,Medium
2262,41,App_41,Travel,3,"Pretty okay app, standard overall.",1,24,352.5,0,2.0,2024-07-05,3480,0.041666666666666664,1,34,5,pretty okay app standard overall,Neutral,0,Medium,Large
2263,2,App_2,News,4,"Love this app, very great and excellent!",11,18,288.1,0,1.2,2024-11-05,6509,0.6111111111111112,1,40,7,love this app very great and excellent,Positive,3,High,Large
2264,36,App_36,Entertainment,4,"Love this app, very love and awesome!",16,17,358.3,0,1.0,2024-08-29,4062,0.9411764705882353,1,37,7,love this app very love and awesome,Positive,3,High,Large
2265,37,App_37,Health & Fitness,2,"Hate this app, full of crash and awful issues.",12,8,485.3,0.99,2.0,2024-08-12,7346,1.5,0,46,9,hate this app full of crash and awful issues,Negative,3,Low,Large
2266,44,App_44,Entertainment,5,This app is excellent! Really great experience.,2,16,347.9,1.99,2.0,2024-11-28,6977,0.125,0,47,7,this app is excellent really great experience,Positive,2,High,Large
2267,34,App_34,Productivity,2,Horrible app with bug problems!,10,9,429.9,0,1.1,2024-10-20,3105,1.1111111111111112,1,31,5,horrible app with bug problems,Negative,2,Low,Large
2268,3,App_3,Games,3,"The app is standard, nothing special. Just average.",17,13,333.7,0,2.0,2025-06-24,6236,1.3076923076923077,1,51,8,the app is standard nothing special just average,Neutral,0,Medium,Large
2269,2,App_2,News,2,This app is useless. Very horrible experience.,4,16,439.3,0,1.1,2025-06-03,4246,0.25,1,46,7,this app is useless very horrible experience,Negative,2,Low,Large
2270,21,App_21,Health & Fitness,5,Love app with fantastic features!,6,26,11.4,2.99,1.0,2025-06-13,1858,0.23076923076923078,0,33,5,love app with fantastic features,Positive,2,High,Small
2271,39,App_39,Travel,4,Love app with amazing features!,14,17,61.4,0,1.2,2024-10-03,1734,0.8235294117647058,1,31,5,love app with amazing features,Positive,2,High,Medium
2272,42,App_42,Entertainment,2,This app is useless. Very horrible experience.,10,18,441.0,0.99,1.1,2024-08-17,1828,0.5555555555555556,0,46,7,this app is useless very horrible experience,Negative,2,Low,Large
2273,15,App_15,Games,4,Perfect app with love features!,14,14,215.2,0,2.0,2024-12-13,3791,1.0,1,31,5,perfect app with love features,Positive,2,High,Large
2274,42,App_42,Games,4,This app is outstanding! Really amazing experience.,4,22,319.4,0,1.2,2024-09-13,5965,0.18181818181818182,1,51,7,this app is outstanding really amazing experience,Positive,2,High,Large
2275,45,App_45,Business,5,"Love this app, very wonderful and great!",7,3,496.8,1.99,1.0,2025-06-14,6715,2.3333333333333335,0,40,7,love this app very wonderful and great,Positive,3,High,Large
2276,14,App_14,Entertainment,4,"Love this app, very great and fantastic!",6,20,226.7,0,1.1,2025-05-15,3044,0.3,1,40,7,love this app very great and fantastic,Positive,3,High,Large
2277,9,App_9,Health & Fitness,4,"Love this app, very brilliant and love!",13,24,432.4,0.99,1.0,2024-12-07,8959,0.5416666666666666,0,39,7,love this app very brilliant and love,Positive,3,High,Large
2278,45,App_45,Social,4,"Love this app, very outstanding and wonderful!",12,28,449.5,0.99,2.1,2025-03-14,7703,0.42857142857142855,0,46,7,love this app very outstanding and wonderful,Positive,3,High,Large
2279,28,App_28,News,5,This app is outstanding! Really awesome experience.,2,24,329.1,1.99,1.1,2024-11-09,7578,0.08333333333333333,0,51,7,this app is outstanding really awesome experience,Positive,2,High,Large
2280,11,App_11,Productivity,2,"Hate this app, full of bug and disappointing issues.",14,17,416.2,0,2.1,2024-07-09,4190,0.8235294117647058,1,52,9,hate this app full of bug and disappointing issues,Negative,3,Low,Large
2281,26,App_26,Social,4,This app is fantastic! Really awesome experience.,5,18,458.8,0.99,2.1,2024-08-25,1011,0.2777777777777778,0,49,7,this app is fantastic really awesome experience,Positive,2,High,Large
2282,38,App_38,Travel,4,Love app with awesome features!,17,4,72.1,0,2.0,2024-10-30,8616,4.25,1,31,5,love app with awesome features,Positive,2,High,Medium
2283,21,App_21,Travel,2,"Hate this app, full of crash and bug issues.",0,18,420.1,2.99,1.2,2024-10-03,1403,0.0,0,44,9,hate this app full of crash and bug issues,Negative,3,Low,Large
2284,5,App_5,Business,3,"The app is okay, nothing special. Just fine.",12,11,244.0,0,2.1,2025-05-28,3278,1.0909090909090908,1,44,8,the app is okay nothing special just fine,Neutral,0,Medium,Large
2285,23,App_23,Health & Fitness,4,Awesome app with amazing features!,17,15,44.7,0,1.2,2024-10-06,8021,1.1333333333333333,1,34,5,awesome app with amazing features,Positive,2,High,Small
2286,42,App_42,Education,1,Terrible app with disappointing problems!,19,6,134.6,0,1.1,2024-10-08,8327,3.1666666666666665,1,41,5,terrible app with disappointing problems,Negative,2,Low,Medium
2287,32,App_32,Education,4,Wonderful app with great features!,7,21,13.2,0,1.1,2025-06-23,3023,0.3333333333333333,1,34,5,wonderful app with great features,Positive,2,High,Small
2288,10,App_10,Education,2,Terrible app with awful problems!,16,13,418.6,0,1.2,2025-04-06,1376,1.2307692307692308,1,33,5,terrible app with awful problems,Negative,2,Low,Large
2289,42,App_42,Travel,4,This app is awesome! Really excellent experience.,5,8,426.2,0,1.1,2025-05-03,1256,0.625,1,49,7,this app is awesome really excellent experience,Positive,2,High,Large
2290,3,App_3,Games,3,"The app is fine, nothing special. Just average.",4,26,134.5,0,2.0,2024-08-03,7938,0.15384615384615385,1,47,8,the app is fine nothing special just average,Neutral,0,Medium,Medium
2291,45,App_45,Travel,2,This app is crash. Very useless experience.,15,26,368.7,0,1.0,2024-07-10,6351,0.5769230769230769,1,43,7,this app is crash very useless experience,Negative,2,Low,Large
2292,45,App_45,Social,4,"Love this app, very perfect and brilliant!",19,12,451.1,0.99,2.0,2025-02-22,1814,1.5833333333333333,0,42,7,love this app very perfect and brilliant,Positive,3,High,Large
2293,35,App_35,Finance,4,Love app with awesome features!,9,9,470.2,0,1.2,2025-05-30,5598,1.0,1,31,5,love app with awesome features,Positive,2,High,Large
2294,28,App_28,News,3,"Pretty decent app, fine overall.",16,7,334.8,1.99,2.1,2025-03-23,5860,2.2857142857142856,0,32,5,pretty decent app fine overall,Neutral,0,Medium,Large
2295,15,App_15,Education,4,Outstanding app with fantastic features!,5,28,211.2,0,2.0,2024-12-14,5910,0.17857142857142858,1,40,5,outstanding app with fantastic features,Positive,2,High,Large
2296,16,App_16,Productivity,4,"Love this app, very great and wonderful!",11,17,238.1,2.99,2.1,2025-02-04,4992,0.6470588235294118,0,40,7,love this app very great and wonderful,Positive,3,High,Large
2297,42,App_42,Health & Fitness,2,This app is disappointing. Very slow experience.,20,9,153.9,1.99,2.0,2024-08-31,6524,2.2222222222222223,0,48,7,this app is disappointing very slow experience,Negative,2,Low,Large
2298,3,App_3,Education,5,"Love this app, very great and perfect!",1,12,497.3,0,1.1,2024-10-03,5409,0.08333333333333333,1,38,7,love this app very great and perfect,Positive,3,High,Large
2299,11,App_11,Games,4,This app is great! Really wonderful experience.,8,6,459.3,0.99,1.1,2024-09-15,1748,1.3333333333333333,0,47,7,this app is great really wonderful experience,Positive,2,High,Large
2300,29,App_29,Entertainment,4,Wonderful app with excellent features!,10,9,319.3,2.99,1.0,2025-03-01,1468,1.1111111111111112,0,38,5,wonderful app with excellent features,Positive,2,High,Large
2301,9,App_9,Education,1,This app is slow. Very useless experience.,11,2,339.9,0.99,1.0,2025-01-30,6627,5.5,0,42,7,this app is slow very useless experience,Negative,2,Low,Large
2302,12,App_12,News,1,This app is awful. Very horrible experience.,10,8,442.9,0,2.0,2024-08-31,5338,1.25,1,44,7,this app is awful very horrible experience,Negative,2,Low,Large
2303,44,App_44,Entertainment,5,Love app with wonderful features!,10,7,43.9,0.99,1.0,2025-05-06,3330,1.4285714285714286,0,33,5,love app with wonderful features,Positive,2,High,Small
2304,23,App_23,Travel,3,"The app is okay, nothing special. Just normal.",12,12,96.4,0,1.2,2025-04-17,8112,1.0,1,46,8,the app is okay nothing special just normal,Neutral,0,Medium,Medium
2305,25,App_25,Productivity,5,Awesome app with amazing features!,1,17,184.9,0,1.1,2024-09-22,6735,0.058823529411764705,1,34,5,awesome app with amazing features,Positive,2,High,Large
2306,22,App_22,Social,3,"The app is normal, nothing special. Just fine.",19,27,454.9,0,1.1,2025-01-18,2536,0.7037037037037037,1,46,8,the app is normal nothing special just fine,Neutral,0,Medium,Large
2307,43,App_43,Business,1,"Hate this app, full of useless and disappointing issues.",7,23,229.6,0,2.0,2025-04-24,8764,0.30434782608695654,1,56,9,hate this app full of useless and disappointing issues,Negative,3,Low,Large
2308,7,App_7,Health & Fitness,2,This app is crash. Very worst experience.,14,9,195.7,4.99,1.1,2025-05-19,6201,1.5555555555555556,0,41,7,this app is crash very worst experience,Negative,2,Low,Large
2309,24,App_24,Health & Fitness,5,"Love this app, very excellent and fantastic!",3,6,377.9,0,1.2,2024-10-06,2941,0.5,1,44,7,love this app very excellent and fantastic,Positive,3,High,Large
2310,42,App_42,Finance,4,This app is fantastic! Really excellent experience.,18,20,466.8,0,1.1,2025-05-21,8069,0.9,1,51,7,this app is fantastic really excellent experience,Positive,2,High,Large
2311,16,App_16,Travel,3,"The app is decent, nothing special. Just normal.",13,24,249.6,0,1.2,2025-06-16,6405,0.5416666666666666,1,48,8,the app is decent nothing special just normal,Neutral,0,Medium,Large
2312,38,App_38,News,4,Excellent app with brilliant features!,13,15,117.6,1.99,1.1,2025-03-14,5594,0.8666666666666667,0,38,5,excellent app with brilliant features,Positive,2,High,Medium
2313,50,App_50,News,5,This app is outstanding! Really brilliant experience.,9,17,175.4,2.99,1.2,2024-08-04,3494,0.5294117647058824,0,53,7,this app is outstanding really brilliant experience,Positive,2,High,Large
2314,24,App_24,Travel,1,"Hate this app, full of worst and bug issues.",11,2,430.2,0,1.1,2025-03-03,2754,5.5,1,44,9,hate this app full of worst and bug issues,Negative,3,Low,Large
2315,9,App_9,Finance,3,"Pretty normal app, standard overall.",12,15,96.5,0.99,1.0,2025-01-14,5797,0.8,0,36,5,pretty normal app standard overall,Neutral,0,Medium,Medium
2316,48,App_48,Business,4,This app is perfect! Really love experience.,16,28,355.1,0.99,1.1,2024-11-21,7103,0.5714285714285714,0,44,7,this app is perfect really love experience,Positive,2,High,Large
2317,6,App_6,Games,3,"Standard performance, average user experience.",18,16,244.4,0.99,1.0,2025-01-19,1258,1.125,0,46,5,standard performance average user experience,Neutral,0,Medium,Large
2318,44,App_44,Travel,4,Amazing app with wonderful features!,4,13,452.1,4.99,1.0,2024-11-13,4500,0.3076923076923077,0,36,5,amazing app with wonderful features,Positive,2,High,Large
2319,33,App_33,Social,5,Fantastic app with excellent features!,19,3,373.1,0.99,2.0,2025-03-07,3549,6.333333333333333,0,38,5,fantastic app with excellent features,Positive,2,High,Large
2320,38,App_38,News,2,Worst app with bug problems!,2,26,164.5,0,2.0,2024-11-22,8930,0.07692307692307693,1,28,5,worst app with bug problems,Negative,2,Low,Large
