id,app_id,app_name,category,rating,review_text,helpful_votes,total_votes,app_size_mb,price,version,date,user_id,helpful_ratio,is_free,review_length,review_word_count,cleaned_review,sentiment_label,sentiment_score,rating_category,size_category
684,39,App_39,Education,5,"Love this app, very fantastic and great!",0,11,221.3,0,2.1,2025-01-21,7258,0.0,1,40,7,love this app very fantastic and great,Positive,3,High,Large
685,8,App_8,Social,3,"Pretty decent app, average overall.",4,6,131.5,0,1.2,2024-12-06,3772,0.6666666666666666,1,35,5,pretty decent app average overall,Neutral,0,Medium,Medium
686,21,App_21,Productivity,1,"Hate this app, full of terrible and disappointing issues.",12,4,163.4,0,1.2,2025-02-20,7152,3.0,1,57,9,hate this app full of terrible and disappointing issues,Negative,3,Low,Large
687,8,App_8,Games,5,Love app with brilliant features!,18,8,249.0,0.99,2.0,2025-05-05,5412,2.25,0,33,5,love app with brilliant features,Positive,2,High,Large
688,30,App_30,News,1,"Hate this app, full of bug and awful issues.",0,14,318.6,2.99,1.0,2025-02-15,2663,0.0,0,44,9,hate this app full of bug and awful issues,Negative,3,Low,Large
689,36,App_36,Productivity,3,"Pretty normal app, decent overall.",14,3,423.9,0,1.1,2024-12-23,9854,4.666666666666667,1,34,5,pretty normal app decent overall,Neutral,0,Medium,Large
690,16,App_16,News,5,"Love this app, very fantastic and outstanding!",1,1,407.3,4.99,2.1,2025-02-04,3742,1.0,0,46,7,love this app very fantastic and outstanding,Positive,3,High,Large
691,31,App_31,Business,1,Disappointing app with horrible problems!,12,12,422.0,0,2.1,2025-02-08,1745,1.0,1,41,5,disappointing app with horrible problems,Negative,2,Low,Large
692,35,App_35,Travel,2,This app is awful. Very horrible experience.,12,23,65.9,0,2.1,2025-02-09,8077,0.5217391304347826,1,44,7,this app is awful very horrible experience,Negative,2,Low,Medium
693,33,App_33,Education,3,"Standard performance, normal user experience.",8,25,355.3,0,1.2,2025-01-09,4450,0.32,1,45,5,standard performance normal user experience,Neutral,0,Medium,Large
694,39,App_39,Education,4,Great app with excellent features!,0,20,240.9,2.99,1.1,2024-12-03,9011,0.0,0,34,5,great app with excellent features,Positive,2,High,Large
695,35,App_35,Social,5,This app is amazing! Really outstanding experience.,14,22,66.1,4.99,2.0,2024-08-29,6864,0.6363636363636364,0,51,7,this app is amazing really outstanding experience,Positive,2,High,Medium
696,50,App_50,Games,3,"Pretty okay app, fine overall.",6,15,9.6,0.99,1.2,2024-07-19,6862,0.4,0,30,5,pretty okay app fine overall,Neutral,0,Medium,Small
697,40,App_40,Business,2,"Hate this app, full of worst and disappointing issues.",11,2,144.0,2.99,2.1,2025-03-17,1116,5.5,0,54,9,hate this app full of worst and disappointing issues,Negative,3,Low,Medium
698,41,App_41,Health & Fitness,2,Awful app with horrible problems!,16,16,89.4,0,2.1,2024-07-23,3875,1.0,1,33,5,awful app with horrible problems,Negative,2,Low,Medium
699,9,App_9,Social,1,Hate app with horrible problems!,7,29,263.9,0.99,1.1,2024-07-20,1378,0.2413793103448276,0,32,5,hate app with horrible problems,Negative,2,Low,Large
700,45,App_45,News,5,Brilliant app with perfect features!,17,29,229.7,2.99,1.0,2025-01-18,8086,0.5862068965517241,0,36,5,brilliant app with perfect features,Positive,2,High,Large
701,27,App_27,Business,5,"Love this app, very amazing and outstanding!",15,12,261.0,0,1.1,2025-06-08,5553,1.25,1,44,7,love this app very amazing and outstanding,Positive,3,High,Large
702,35,App_35,Finance,5,"Love this app, very awesome and great!",6,11,45.5,0,1.0,2025-03-09,7943,0.5454545454545454,1,38,7,love this app very awesome and great,Positive,3,High,Small
703,16,App_16,Entertainment,5,"Love this app, very excellent and awesome!",2,21,314.5,0,2.0,2025-06-20,6477,0.09523809523809523,1,42,7,love this app very excellent and awesome,Positive,3,High,Large
704,16,App_16,Social,5,"Love this app, very wonderful and love!",1,27,170.1,0.99,1.0,2024-08-29,8184,0.037037037037037035,0,39,7,love this app very wonderful and love,Positive,3,High,Large
705,41,App_41,Finance,5,This app is brilliant! Really amazing experience.,1,30,21.5,0,1.0,2025-04-28,2015,0.03333333333333333,1,49,7,this app is brilliant really amazing experience,Positive,2,High,Small
706,29,App_29,Games,5,This app is perfect! Really fantastic experience.,3,22,32.6,0,2.0,2024-12-09,2570,0.13636363636363635,1,49,7,this app is perfect really fantastic experience,Positive,2,High,Small
707,27,App_27,Entertainment,4,"Love this app, very brilliant and great!",12,15,398.6,1.99,2.1,2025-05-12,6564,0.8,0,40,7,love this app very brilliant and great,Positive,3,High,Large
708,44,App_44,Games,4,"Love this app, very wonderful and outstanding!",18,7,58.5,0,1.0,2024-09-02,4172,2.5714285714285716,1,46,7,love this app very wonderful and outstanding,Positive,3,High,Medium
709,9,App_9,News,5,"Love this app, very perfect and awesome!",15,24,312.3,0,1.1,2025-06-10,1991,0.625,1,40,7,love this app very perfect and awesome,Positive,3,High,Large
710,38,App_38,Health & Fitness,2,"Hate this app, full of slow and useless issues.",18,29,272.9,0,2.0,2025-01-25,6618,0.6206896551724138,1,47,9,hate this app full of slow and useless issues,Negative,3,Low,Large
711,1,App_1,News,3,"The app is decent, nothing special. Just average.",7,17,410.5,0,1.0,2024-11-28,6633,0.4117647058823529,1,49,8,the app is decent nothing special just average,Neutral,0,Medium,Large
712,13,App_13,Entertainment,2,This app is awful. Very useless experience.,15,23,347.5,0,1.2,2024-09-09,6499,0.6521739130434783,1,43,7,this app is awful very useless experience,Negative,2,Low,Large
713,27,App_27,Education,4,"Love this app, very excellent and amazing!",1,16,113.6,0,1.1,2024-07-13,4772,0.0625,1,42,7,love this app very excellent and amazing,Positive,3,High,Medium
714,14,App_14,Entertainment,4,Wonderful app with awesome features!,12,7,203.2,1.99,1.0,2024-12-29,1162,1.7142857142857142,0,36,5,wonderful app with awesome features,Positive,2,High,Large
715,2,App_2,News,1,"Hate this app, full of awful and hate issues.",14,7,317.5,2.99,1.2,2025-06-10,1486,2.0,0,45,9,hate this app full of awful and hate issues,Negative,3,Low,Large
716,19,App_19,Productivity,2,Worst app with horrible problems!,5,11,424.5,0,1.1,2025-06-21,3884,0.45454545454545453,1,33,5,worst app with horrible problems,Negative,2,Low,Large
717,7,App_7,Games,5,Excellent app with fantastic features!,3,11,468.4,0,1.1,2024-12-25,7100,0.2727272727272727,1,38,5,excellent app with fantastic features,Positive,2,High,Large
718,34,App_34,Travel,4,This app is fantastic! Really amazing experience.,4,29,462.5,0.99,1.1,2024-10-03,7196,0.13793103448275862,0,49,7,this app is fantastic really amazing experience,Positive,2,High,Large
719,21,App_21,Travel,4,This app is fantastic! Really love experience.,19,19,98.6,0,1.1,2025-01-16,5049,1.0,1,46,7,this app is fantastic really love experience,Positive,2,High,Medium
720,18,App_18,Productivity,1,This app is slow. Very crash experience.,2,26,238.0,0.99,1.0,2025-04-08,9333,0.07692307692307693,0,40,7,this app is slow very crash experience,Negative,2,Low,Large
721,42,App_42,News,3,"Normal performance, fine user experience.",14,6,164.3,0,2.0,2024-10-22,8762,2.3333333333333335,1,41,5,normal performance fine user experience,Neutral,0,Medium,Large
722,26,App_26,Travel,3,"The app is standard, nothing special. Just okay.",7,29,105.5,1.99,2.0,2025-03-13,6013,0.2413793103448276,0,48,8,the app is standard nothing special just okay,Neutral,0,Medium,Medium
723,25,App_25,Travel,4,"Love this app, very excellent and awesome!",17,3,71.5,0,2.0,2024-10-10,6760,5.666666666666667,1,42,7,love this app very excellent and awesome,Positive,3,High,Medium
724,3,App_3,Finance,3,"Pretty decent app, standard overall.",13,15,236.4,0,2.0,2025-01-21,5473,0.8666666666666667,1,36,5,pretty decent app standard overall,Neutral,0,Medium,Large
725,12,App_12,Finance,3,"Average performance, normal user experience.",2,12,451.2,0,2.1,2024-10-13,9956,0.16666666666666666,1,44,5,average performance normal user experience,Neutral,0,Medium,Large
726,18,App_18,Entertainment,4,This app is amazing! Really brilliant experience.,11,2,275.3,0,1.2,2025-02-24,5959,5.5,1,49,7,this app is amazing really brilliant experience,Positive,2,High,Large
727,50,App_50,Business,4,Love app with excellent features!,17,30,134.3,0.99,1.2,2025-01-06,7616,0.5666666666666667,0,33,5,love app with excellent features,Positive,2,High,Medium
728,38,App_38,Games,5,This app is wonderful! Really outstanding experience.,12,8,117.3,0.99,2.0,2025-03-05,9451,1.5,0,53,7,this app is wonderful really outstanding experience,Positive,2,High,Medium
729,36,App_36,Finance,4,This app is wonderful! Really awesome experience.,10,28,98.0,0.99,2.0,2025-03-17,8187,0.35714285714285715,0,49,7,this app is wonderful really awesome experience,Positive,2,High,Medium
730,36,App_36,Games,4,Awesome app with excellent features!,4,10,472.0,0,1.2,2025-01-10,4694,0.4,1,36,5,awesome app with excellent features,Positive,2,High,Large
731,44,App_44,Health & Fitness,4,"Love this app, very outstanding and perfect!",18,1,286.0,0,1.1,2025-04-15,6410,18.0,1,44,7,love this app very outstanding and perfect,Positive,3,High,Large
732,39,App_39,Travel,4,"Love this app, very brilliant and fantastic!",6,13,36.5,0,2.0,2025-05-08,6387,0.46153846153846156,1,44,7,love this app very brilliant and fantastic,Positive,3,High,Small
733,29,App_29,Business,4,This app is amazing! Really excellent experience.,17,6,20.9,0.99,2.0,2025-06-19,4058,2.8333333333333335,0,49,7,this app is amazing really excellent experience,Positive,2,High,Small
734,25,App_25,Business,2,"Hate this app, full of worst and disappointing issues.",16,3,230.1,0,1.0,2025-04-06,6353,5.333333333333333,1,54,9,hate this app full of worst and disappointing issues,Negative,3,Low,Large
735,27,App_27,Health & Fitness,5,This app is excellent! Really amazing experience.,17,14,241.7,0,1.1,2025-04-27,4369,1.2142857142857142,1,49,7,this app is excellent really amazing experience,Positive,2,High,Large
736,46,App_46,Finance,3,"Average performance, decent user experience.",9,19,105.5,0.99,2.0,2025-02-11,4304,0.47368421052631576,0,44,5,average performance decent user experience,Neutral,0,Medium,Medium
737,10,App_10,Finance,1,Awful app with bug problems!,7,17,167.8,0,2.0,2024-11-09,8580,0.4117647058823529,1,28,5,awful app with bug problems,Negative,2,Low,Large
738,48,App_48,Social,4,"Love this app, very perfect and wonderful!",9,13,308.4,1.99,1.1,2024-12-02,5081,0.6923076923076923,0,42,7,love this app very perfect and wonderful,Positive,3,High,Large
739,40,App_40,Health & Fitness,2,Crash app with bug problems!,5,23,286.5,0,1.0,2025-03-02,3587,0.21739130434782608,1,28,5,crash app with bug problems,Negative,2,Low,Large
740,41,App_41,News,3,"Normal performance, okay user experience.",6,30,249.3,4.99,2.1,2025-05-01,7041,0.2,0,41,5,normal performance okay user experience,Neutral,0,Medium,Large
741,7,App_7,News,1,"Hate this app, full of useless and bug issues.",5,9,107.6,0,1.0,2025-05-26,8567,0.5555555555555556,1,46,9,hate this app full of useless and bug issues,Negative,3,Low,Medium
742,48,App_48,Health & Fitness,3,"The app is average, nothing special. Just fine.",0,9,61.8,2.99,1.2,2024-07-24,8606,0.0,0,47,8,the app is average nothing special just fine,Neutral,0,Medium,Medium
743,5,App_5,Social,4,Outstanding app with love features!,14,5,238.0,0,1.1,2025-04-06,1295,2.8,1,35,5,outstanding app with love features,Positive,2,High,Large
744,12,App_12,Business,4,Amazing app with outstanding features!,12,6,43.4,0.99,1.2,2025-04-15,8219,2.0,0,38,5,amazing app with outstanding features,Positive,2,High,Small
745,14,App_14,Games,3,"The app is standard, nothing special. Just decent.",14,23,28.6,0.99,2.1,2024-08-08,2684,0.6086956521739131,0,50,8,the app is standard nothing special just decent,Neutral,0,Medium,Small
746,20,App_20,Finance,3,"The app is okay, nothing special. Just decent.",1,25,191.8,0,1.1,2024-12-23,4908,0.04,1,46,8,the app is okay nothing special just decent,Neutral,0,Medium,Large
747,2,App_2,Health & Fitness,2,"Hate this app, full of terrible and disappointing issues.",6,22,336.1,0,1.0,2024-07-27,3750,0.2727272727272727,1,57,9,hate this app full of terrible and disappointing issues,Negative,3,Low,Large
748,3,App_3,Health & Fitness,4,"Love this app, very outstanding and amazing!",10,18,315.3,0.99,2.1,2024-12-12,8010,0.5555555555555556,0,44,7,love this app very outstanding and amazing,Positive,3,High,Large
749,14,App_14,Social,2,This app is useless. Very disappointing experience.,0,13,328.7,0,1.1,2024-11-10,4606,0.0,1,51,7,this app is useless very disappointing experience,Negative,2,Low,Large
750,18,App_18,Travel,1,This app is useless. Very terrible experience.,6,14,154.3,0,1.0,2024-07-03,9784,0.42857142857142855,1,46,7,this app is useless very terrible experience,Negative,2,Low,Large
751,37,App_37,Productivity,5,Perfect app with amazing features!,10,21,349.7,0.99,1.1,2025-01-13,3872,0.47619047619047616,0,34,5,perfect app with amazing features,Positive,2,High,Large
752,45,App_45,Education,4,"Love this app, very wonderful and amazing!",0,20,456.5,0,2.1,2024-08-09,4808,0.0,1,42,7,love this app very wonderful and amazing,Positive,3,High,Large
753,46,App_46,Games,4,Love app with great features!,3,10,122.0,0,1.1,2024-08-19,2300,0.3,1,29,5,love app with great features,Positive,2,High,Medium
754,24,App_24,Finance,1,This app is horrible. Very worst experience.,12,7,322.8,0,2.1,2024-11-17,6385,1.7142857142857142,1,44,7,this app is horrible very worst experience,Negative,2,Low,Large
755,21,App_21,Games,2,Slow app with bug problems!,9,25,16.7,1.99,1.2,2025-01-08,4969,0.36,0,27,5,slow app with bug problems,Negative,2,Low,Small
756,4,App_4,Entertainment,3,"Standard performance, average user experience.",12,17,164.2,0,1.0,2025-05-30,9055,0.7058823529411765,1,46,5,standard performance average user experience,Neutral,0,Medium,Large
757,13,App_13,Games,1,This app is hate. Very worst experience.,2,6,298.4,1.99,1.1,2025-03-04,9313,0.3333333333333333,0,40,7,this app is hate very worst experience,Negative,2,Low,Large
758,47,App_47,Finance,1,Horrible app with hate problems!,6,8,214.9,0.99,1.2,2025-02-06,8344,0.75,0,32,5,horrible app with hate problems,Negative,2,Low,Large
759,13,App_13,Business,5,"Love this app, very wonderful and amazing!",12,13,88.0,0,2.1,2024-08-24,8101,0.9230769230769231,1,42,7,love this app very wonderful and amazing,Positive,3,High,Medium
760,31,App_31,Games,5,This app is fantastic! Really brilliant experience.,9,20,270.9,0,1.1,2025-02-21,7233,0.45,1,51,7,this app is fantastic really brilliant experience,Positive,2,High,Large
761,30,App_30,Business,4,Fantastic app with outstanding features!,15,3,170.0,0.99,1.1,2025-04-14,4106,5.0,0,40,5,fantastic app with outstanding features,Positive,2,High,Large
762,33,App_33,Education,1,"Hate this app, full of crash and bug issues.",12,24,189.7,0,2.1,2025-05-27,7697,0.5,1,44,9,hate this app full of crash and bug issues,Negative,3,Low,Large
763,8,App_8,Health & Fitness,5,This app is brilliant! Really excellent experience.,13,9,386.8,0.99,1.2,2024-10-15,9005,1.4444444444444444,0,51,7,this app is brilliant really excellent experience,Positive,2,High,Large
764,24,App_24,Games,4,Fantastic app with brilliant features!,7,8,241.5,2.99,1.2,2024-08-13,1462,0.875,0,38,5,fantastic app with brilliant features,Positive,2,High,Large
765,42,App_42,Productivity,4,Perfect app with wonderful features!,4,9,127.5,0,1.1,2025-06-26,2912,0.4444444444444444,1,36,5,perfect app with wonderful features,Positive,2,High,Medium
766,42,App_42,Health & Fitness,5,Fantastic app with amazing features!,6,29,214.4,1.99,1.2,2024-07-13,5951,0.20689655172413793,0,36,5,fantastic app with amazing features,Positive,2,High,Large
767,35,App_35,Health & Fitness,4,Brilliant app with perfect features!,13,25,438.8,0.99,1.0,2025-05-08,6642,0.52,0,36,5,brilliant app with perfect features,Positive,2,High,Large
768,18,App_18,Entertainment,5,This app is fantastic! Really perfect experience.,5,27,248.4,0,2.0,2024-10-07,7829,0.18518518518518517,1,49,7,this app is fantastic really perfect experience,Positive,2,High,Large
769,47,App_47,Health & Fitness,4,"Love this app, very excellent and brilliant!",5,23,71.5,0,2.1,2025-05-07,8383,0.21739130434782608,1,44,7,love this app very excellent and brilliant,Positive,3,High,Medium
770,14,App_14,Productivity,4,Love app with great features!,5,26,380.8,0,2.0,2024-11-19,2789,0.19230769230769232,1,29,5,love app with great features,Positive,2,High,Large
771,11,App_11,Social,5,"Love this app, very perfect and amazing!",3,9,36.8,0,1.1,2024-10-31,8949,0.3333333333333333,1,40,7,love this app very perfect and amazing,Positive,3,High,Small
772,7,App_7,Games,4,This app is great! Really perfect experience.,18,26,493.9,0,2.1,2025-06-29,7154,0.6923076923076923,1,45,7,this app is great really perfect experience,Positive,2,High,Large
773,49,App_49,Business,4,"Love this app, very wonderful and brilliant!",19,14,171.6,0.99,1.2,2025-01-22,4925,1.3571428571428572,0,44,7,love this app very wonderful and brilliant,Positive,3,High,Large
774,43,App_43,Health & Fitness,5,"Love this app, very fantastic and great!",10,26,54.6,0,2.0,2025-04-22,1420,0.38461538461538464,1,40,7,love this app very fantastic and great,Positive,3,High,Medium
775,34,App_34,Business,4,"Love this app, very love and awesome!",19,22,331.1,0,2.0,2024-07-29,4079,0.8636363636363636,1,37,7,love this app very love and awesome,Positive,3,High,Large
776,41,App_41,Education,1,This app is terrible. Very useless experience.,10,22,224.9,0.99,2.0,2024-08-23,2333,0.45454545454545453,0,46,7,this app is terrible very useless experience,Negative,2,Low,Large
777,31,App_31,Social,3,"Pretty standard app, fine overall.",19,7,357.4,1.99,2.1,2024-10-17,1520,2.7142857142857144,0,34,5,pretty standard app fine overall,Neutral,0,Medium,Large
778,6,App_6,Business,2,This app is slow. Very crash experience.,14,4,243.7,0,1.1,2025-03-16,3792,3.5,1,40,7,this app is slow very crash experience,Negative,2,Low,Large
779,43,App_43,Social,5,Amazing app with fantastic features!,0,6,464.9,0,2.0,2025-02-09,4610,0.0,1,36,5,amazing app with fantastic features,Positive,2,High,Large
780,43,App_43,Finance,4,Amazing app with excellent features!,20,24,248.5,0.99,1.2,2025-03-10,2059,0.8333333333333334,0,36,5,amazing app with excellent features,Positive,2,High,Large
781,25,App_25,Health & Fitness,4,This app is outstanding! Really fantastic experience.,7,9,62.3,0,1.0,2025-01-09,4082,0.7777777777777778,1,53,7,this app is outstanding really fantastic experience,Positive,2,High,Medium
782,8,App_8,Travel,4,"Love this app, very awesome and excellent!",12,19,369.8,0,2.1,2024-10-01,4110,0.631578947368421,1,42,7,love this app very awesome and excellent,Positive,3,High,Large
783,28,App_28,Education,5,Awesome app with excellent features!,19,19,115.0,0,2.1,2024-11-09,6176,1.0,1,36,5,awesome app with excellent features,Positive,2,High,Medium
784,19,App_19,Entertainment,2,This app is crash. Very disappointing experience.,19,10,77.2,0.99,1.0,2024-08-30,6245,1.9,0,49,7,this app is crash very disappointing experience,Negative,2,Low,Medium
785,45,App_45,Social,3,"Pretty normal app, decent overall.",20,27,111.8,0,2.0,2025-06-02,6458,0.7407407407407407,1,34,5,pretty normal app decent overall,Neutral,0,Medium,Medium
786,46,App_46,Entertainment,2,This app is worst. Very terrible experience.,15,24,198.9,4.99,1.1,2025-06-21,9977,0.625,0,44,7,this app is worst very terrible experience,Negative,2,Low,Large
787,28,App_28,Finance,3,"Pretty normal app, fine overall.",2,17,364.7,0,1.1,2024-07-09,9978,0.11764705882352941,1,32,5,pretty normal app fine overall,Neutral,0,Medium,Large
788,9,App_9,Education,3,"Decent performance, okay user experience.",9,15,329.0,0,2.0,2024-07-11,8904,0.6,1,41,5,decent performance okay user experience,Neutral,0,Medium,Large
789,10,App_10,Entertainment,3,"Average performance, standard user experience.",20,1,184.3,1.99,1.0,2024-07-20,3418,20.0,0,46,5,average performance standard user experience,Neutral,0,Medium,Large
790,28,App_28,Productivity,3,"Pretty okay app, standard overall.",15,6,472.8,0,2.1,2024-08-04,6545,2.5,1,34,5,pretty okay app standard overall,Neutral,0,Medium,Large
791,10,App_10,Health & Fitness,4,This app is love! Really great experience.,7,13,246.9,0.99,1.1,2024-08-02,7150,0.5384615384615384,0,42,7,this app is love really great experience,Positive,2,High,Large
792,43,App_43,Social,5,"Love this app, very wonderful and fantastic!",20,21,225.3,0,1.0,2025-05-21,2999,0.9523809523809523,1,44,7,love this app very wonderful and fantastic,Positive,3,High,Large
793,43,App_43,News,4,Love app with great features!,18,19,242.4,0.99,1.0,2024-09-02,3967,0.9473684210526315,0,29,5,love app with great features,Positive,2,High,Large
794,42,App_42,Health & Fitness,3,"The app is normal, nothing special. Just decent.",3,11,36.4,2.99,2.1,2025-03-30,7640,0.2727272727272727,0,48,8,the app is normal nothing special just decent,Neutral,0,Medium,Small
795,2,App_2,Health & Fitness,5,Outstanding app with brilliant features!,15,3,261.9,0,1.0,2025-03-18,2922,5.0,1,40,5,outstanding app with brilliant features,Positive,2,High,Large
796,39,App_39,Productivity,2,"Hate this app, full of terrible and slow issues.",10,4,24.4,0,1.1,2025-05-19,5206,2.5,1,48,9,hate this app full of terrible and slow issues,Negative,3,Low,Small
797,3,App_3,Social,5,"Love this app, very amazing and outstanding!",11,18,89.9,4.99,1.0,2025-02-25,5925,0.6111111111111112,0,44,7,love this app very amazing and outstanding,Positive,3,High,Medium
798,34,App_34,Business,1,This app is slow. Very crash experience.,18,16,349.1,0,1.2,2024-08-26,9818,1.125,1,40,7,this app is slow very crash experience,Negative,2,Low,Large
799,45,App_45,Social,4,This app is great! Really love experience.,6,5,153.4,1.99,1.1,2024-08-28,4539,1.2,0,42,7,this app is great really love experience,Positive,2,High,Large
800,18,App_18,Productivity,4,This app is brilliant! Really fantastic experience.,17,9,134.0,0.99,1.1,2024-12-10,8472,1.8888888888888888,0,51,7,this app is brilliant really fantastic experience,Positive,2,High,Medium
801,17,App_17,Health & Fitness,2,This app is hate. Very slow experience.,2,21,367.7,4.99,1.1,2024-07-02,7097,0.09523809523809523,0,39,7,this app is hate very slow experience,Negative,2,Low,Large
802,42,App_42,News,4,"Love this app, very brilliant and excellent!",4,11,496.3,0,1.0,2024-08-27,5055,0.36363636363636365,1,44,7,love this app very brilliant and excellent,Positive,3,High,Large
803,8,App_8,News,1,"Hate this app, full of awful and slow issues.",2,11,321.9,0,1.2,2025-02-13,3397,0.18181818181818182,1,45,9,hate this app full of awful and slow issues,Negative,3,Low,Large
804,15,App_15,Business,5,"Love this app, very great and amazing!",7,13,476.1,0.99,1.0,2025-04-04,9625,0.5384615384615384,0,38,7,love this app very great and amazing,Positive,3,High,Large
805,20,App_20,Travel,4,Wonderful app with amazing features!,11,23,288.2,0,1.2,2024-08-25,2623,0.4782608695652174,1,36,5,wonderful app with amazing features,Positive,2,High,Large
806,11,App_11,Education,5,"Love this app, very fantastic and excellent!",17,18,299.3,1.99,2.0,2024-09-02,3090,0.9444444444444444,0,44,7,love this app very fantastic and excellent,Positive,3,High,Large
807,44,App_44,News,3,"Standard performance, average user experience.",4,5,192.5,0.99,1.0,2024-08-09,7064,0.8,0,46,5,standard performance average user experience,Neutral,0,Medium,Large
808,16,App_16,Travel,4,This app is fantastic! Really wonderful experience.,14,12,400.2,0,1.2,2024-11-25,9529,1.1666666666666667,1,51,7,this app is fantastic really wonderful experience,Positive,2,High,Large
809,15,App_15,Business,5,"Love this app, very amazing and perfect!",10,28,49.6,0,1.1,2025-05-16,3705,0.35714285714285715,1,40,7,love this app very amazing and perfect,Positive,3,High,Small
810,6,App_6,Business,4,This app is outstanding! Really wonderful experience.,13,22,256.8,0.99,2.0,2024-10-21,9437,0.5909090909090909,0,53,7,this app is outstanding really wonderful experience,Positive,2,High,Large
811,44,App_44,News,4,This app is amazing! Really fantastic experience.,19,7,455.9,0.99,2.0,2024-07-08,9754,2.7142857142857144,0,49,7,this app is amazing really fantastic experience,Positive,2,High,Large
812,16,App_16,News,4,Brilliant app with great features!,14,6,338.9,1.99,2.1,2025-03-09,3864,2.3333333333333335,0,34,5,brilliant app with great features,Positive,2,High,Large
813,9,App_9,News,1,"Hate this app, full of useless and terrible issues.",15,13,89.4,4.99,1.2,2024-07-20,5092,1.1538461538461537,0,51,9,hate this app full of useless and terrible issues,Negative,3,Low,Medium
814,50,App_50,Social,5,"Love this app, very perfect and brilliant!",9,9,110.5,0.99,2.1,2024-12-13,4562,1.0,0,42,7,love this app very perfect and brilliant,Positive,3,High,Medium
815,42,App_42,News,5,Great app with wonderful features!,15,2,181.1,0.99,1.2,2025-01-31,6798,7.5,0,34,5,great app with wonderful features,Positive,2,High,Large
816,23,App_23,Productivity,2,This app is bug. Very useless experience.,3,14,248.6,0,2.1,2025-04-15,7729,0.21428571428571427,1,41,7,this app is bug very useless experience,Negative,2,Low,Large
817,32,App_32,Games,2,This app is hate. Very horrible experience.,15,13,190.3,0,1.1,2024-10-01,5415,1.1538461538461537,1,43,7,this app is hate very horrible experience,Negative,2,Low,Large
818,29,App_29,Finance,2,"Hate this app, full of hate and disappointing issues.",13,1,182.8,1.99,1.1,2025-05-07,4105,13.0,0,53,9,hate this app full of hate and disappointing issues,Negative,3,Low,Large
819,9,App_9,Health & Fitness,3,"The app is fine, nothing special. Just normal.",5,22,103.5,0,1.2,2025-05-03,7899,0.22727272727272727,1,46,8,the app is fine nothing special just normal,Neutral,0,Medium,Medium
